{
  "schemaVersion": 1,
  "nodeVersion": "24.17.0",
  "sourceAsset": {
    "url": "https://nodejs.org/dist/v24.17.0/node-v24.17.0.tar.xz",
    "sha256": "a7ab562ed2369a29c68b72fa00e3103bcdfe37063dff799c6acc8e404e275fcd",
    "license": {
      "path": "LICENSE",
      "sha256": "4573185d56580da2b890ba34a85a409257640f1c5632eade4300137266194d18"
    }
  },
  "platforms": {
    "macos-arm64": {
      "licenseFile": {
        "path": "node/LICENSE",
        "sha256": "4573185d56580da2b890ba34a85a409257640f1c5632eade4300137266194d18"
      },
      "processVersions": {
        "node": "24.17.0",
        "acorn": "8.16.0",
        "ada": "3.4.4",
        "amaro": "1.1.9",
        "ares": "1.34.6",
        "brotli": "1.2.0",
        "cldr": "48.0",
        "icu": "78.3",
        "llhttp": "9.4.2",
        "merve": "1.2.2",
        "modules": "137",
        "napi": "10",
        "nbytes": "0.1.4",
        "ncrypto": "0.0.1",
        "nghttp2": "1.69.0",
        "nghttp3": "",
        "ngtcp2": "",
        "openssl": "3.5.7",
        "simdjson": "4.6.1",
        "simdutf": "6.4.0",
        "sqlite": "3.53.0",
        "tz": "2026b",
        "undici": "7.28.0",
        "unicode": "17.0",
        "uv": "1.52.1",
        "uvwasi": "0.0.23",
        "v8": "13.6.233.17-node.49",
        "zlib": "1.3.1-e00f703",
        "zstd": "1.5.7"
      },
      "verification": "verified-native"
    },
    "windows-x64": {
      "licenseFile": {
        "path": "node/LICENSE",
        "sha256": "8efdacdc1cfa3460aeb7fe98e3c54337b971d5da70e6eee292b73b981acb220c"
      },
      "processVersions": {
        "node": "24.17.0",
        "acorn": "8.16.0",
        "ada": "3.4.4",
        "amaro": "1.1.9",
        "ares": "1.34.6",
        "brotli": "1.2.0",
        "cldr": "48.0",
        "icu": "78.3",
        "llhttp": "9.4.2",
        "merve": "1.2.2",
        "modules": "137",
        "napi": "10",
        "nbytes": "0.1.4",
        "ncrypto": "0.0.1",
        "nghttp2": "1.69.0",
        "nghttp3": "",
        "ngtcp2": "",
        "openssl": "3.5.7",
        "simdjson": "4.6.1",
        "simdutf": "6.4.0",
        "sqlite": "3.53.0",
        "tz": "2026b",
        "undici": "7.28.0",
        "unicode": "17.0",
        "uv": "1.52.1",
        "uvwasi": "0.0.23",
        "v8": "13.6.233.17-node.49",
        "zlib": "1.3.1-e00f703",
        "zstd": "1.5.7"
      },
      "verification": "pending-native"
    }
  },
  "licenseNotices": [
    {
      "package": "brace-expansion",
      "version": "5.0.5",
      "tarball": {
        "url": "https://registry.npmjs.org/brace-expansion/-/brace-expansion-5.0.5.tgz",
        "integrity": "sha512-VZznLgtwhn+Mact9tfiwx64fA9erHH/MCXEUfB/0bX/6Fz6ny5EGTXYltMocqg4xFAQZtnO3DHWWXi8RiuN7cQ==",
        "sha256": "e919c0ac902f05c2b3bbd31fd71af6c8ddfd74fadc85321231184d39ca990f31",
        "bytes": 7894
      },
      "archivePath": "package/LICENSE",
      "sourcePath": "packaging/licenses/node-runtime/brace-expansion-5.0.5-LICENSE.txt",
      "payloadPath": "licenses/node-runtime/brace-expansion-5.0.5-LICENSE.txt",
      "sha256": "9c63a23124d68cd30cd316a94a1a0bca34f032786df6df69fc4b5f136bac8d2e"
    },
    {
      "package": "balanced-match",
      "version": "4.0.4",
      "tarball": {
        "url": "https://registry.npmjs.org/balanced-match/-/balanced-match-4.0.4.tgz",
        "integrity": "sha512-BLrgEcRTwX2o6gGxGOCNyMvGSp35YofuYzw9h1IMTRmKqttAZZVU67bdb9Pr2vUHA8+j3i2tJfjO6C6+4myGTA==",
        "sha256": "9025508d9125eee531bbc49ce3ae560183975ad595f058c378bd56af4152fb16",
        "bytes": 4199
      },
      "archivePath": "package/LICENSE.md",
      "sourcePath": "packaging/licenses/node-runtime/balanced-match-4.0.4-LICENSE.txt",
      "payloadPath": "licenses/node-runtime/balanced-match-4.0.4-LICENSE.txt",
      "sha256": "d408f38ffa3355c5faec517153295338892eb0f1ea43f57874bb23c6075979b5"
    }
  ],
  "payloadComponents": [
    { "name": "node-core", "version": "24.17.0", "relationship": "CONTAINS", "disposition": "payload", "licenseDeclared": "MIT", "sourceSubpath": ".", "processVersionKey": "node", "licenseEvidence": { "kind": "license-preamble" } },
    { "name": "acorn", "version": "8.16.0", "relationship": "CONTAINS", "disposition": "payload", "licenseDeclared": "MIT", "sourceSubpath": "deps/acorn", "processVersionKey": "acorn", "licenseEvidence": { "kind": "license-section", "heading": "Acorn", "sourceSubpath": "deps/acorn" } },
    { "name": "acorn-walk", "version": "8.3.5", "relationship": "CONTAINS", "disposition": "payload", "licenseDeclared": "MIT", "sourceSubpath": "deps/acorn/acorn-walk", "licenseEvidence": { "kind": "source-file", "path": "deps/acorn/acorn-walk/LICENSE", "sha256": "c2d8184ea9becd063aa40be243e8c6ec2c4f72828fdfe4b0752664ef73e96ed3" } },
    { "name": "c-ares", "version": "1.34.6", "relationship": "STATIC_LINK", "disposition": "payload", "licenseDeclared": "MIT", "sourceSubpath": "deps/cares", "processVersionKey": "ares", "licenseEvidence": { "kind": "license-section", "heading": "c-ares", "sourceSubpath": "deps/cares" } },
    { "name": "merve", "version": "1.2.2", "relationship": "STATIC_LINK", "disposition": "payload", "licenseDeclared": "MIT", "sourceSubpath": "deps/merve", "processVersionKey": "merve", "licenseEvidence": { "kind": "license-section", "heading": "merve", "sourceSubpath": "deps/merve" } },
    { "name": "amaro", "version": "1.1.9", "relationship": "CONTAINS", "disposition": "payload", "licenseDeclared": "MIT", "sourceSubpath": "deps/amaro", "processVersionKey": "amaro", "licenseEvidence": { "kind": "license-section", "heading": "amaro", "sourceSubpath": "deps/amaro" } },
    { "name": "swc", "version": "1.15.30", "relationship": "CONTAINS", "disposition": "payload", "licenseDeclared": "Apache-2.0", "sourceSubpath": "deps/amaro/dist", "licenseEvidence": { "kind": "license-section", "heading": "swc", "sourceSubpath": "deps/amaro/dist" } },
    { "name": "icu", "version": "78.3", "relationship": "STATIC_LINK", "disposition": "payload", "licenseDeclared": "LicenseRef-Node-ICU-Bundle", "sourceSubpath": "deps/icu-small", "processVersionKey": "icu", "licenseEvidence": { "kind": "license-section", "heading": "ICU", "sourceSubpath": "deps/icu-small" } },
    { "name": "libuv", "version": "1.52.1", "relationship": "STATIC_LINK", "disposition": "payload", "licenseDeclared": "MIT AND BSD-2-Clause AND ISC", "sourceSubpath": "deps/uv", "processVersionKey": "uv", "licenseEvidence": { "kind": "license-section", "heading": "libuv", "sourceSubpath": "deps/uv" } },
    { "name": "llhttp", "version": "9.4.2", "relationship": "STATIC_LINK", "disposition": "payload", "licenseDeclared": "MIT", "sourceSubpath": "deps/llhttp", "processVersionKey": "llhttp", "licenseEvidence": { "kind": "license-section", "heading": "llhttp", "sourceSubpath": "deps/llhttp" } },
    { "name": "undici", "version": "7.28.0", "relationship": "CONTAINS", "disposition": "payload", "licenseDeclared": "MIT", "sourceSubpath": "deps/undici", "processVersionKey": "undici", "licenseEvidence": { "kind": "license-section", "heading": "undici", "sourceSubpath": "deps/undici" } },
    { "name": "openssl", "version": "3.5.7", "relationship": "STATIC_LINK", "disposition": "payload", "licenseDeclared": "Apache-2.0", "sourceSubpath": "deps/openssl", "processVersionKey": "openssl", "licenseEvidence": { "kind": "license-section", "heading": "OpenSSL", "sourceSubpath": "deps/openssl" } },
    { "name": "punycode", "version": "2.1.0", "relationship": "CONTAINS", "disposition": "payload", "licenseDeclared": "MIT", "sourceSubpath": "lib/punycode.js", "licenseEvidence": { "kind": "license-section", "heading": "Punycode.js", "sourceSubpath": "lib/punycode.js" } },
    { "name": "v8", "version": "13.6.233.17-node.49", "relationship": "STATIC_LINK", "disposition": "payload", "licenseDeclared": "LicenseRef-Node-V8-Bundle", "sourceSubpath": "deps/v8", "processVersionKey": "v8", "licenseEvidence": { "kind": "license-section", "heading": "V8", "sourceSubpath": "deps/v8" } },
    { "name": "siphash", "version": "vendored-24.17.0", "relationship": "STATIC_LINK", "disposition": "payload", "licenseDeclared": "CC0-1.0", "sourceSubpath": "deps/v8/src/third_party/siphash", "licenseEvidence": { "kind": "license-section", "heading": "SipHash", "sourceSubpath": "deps/v8/src/third_party/siphash" } },
    { "name": "zlib", "version": "1.3.1-e00f703", "relationship": "STATIC_LINK", "disposition": "payload", "licenseDeclared": "Zlib", "sourceSubpath": "deps/zlib", "processVersionKey": "zlib", "licenseEvidence": { "kind": "license-section", "heading": "zlib", "sourceSubpath": "deps/zlib" } },
    { "name": "simdjson", "version": "4.6.1", "relationship": "STATIC_LINK", "disposition": "payload", "licenseDeclared": "Apache-2.0", "sourceSubpath": "deps/simdjson", "processVersionKey": "simdjson", "licenseEvidence": { "kind": "license-section", "heading": "simdjson", "sourceSubpath": "deps/simdjson" } },
    { "name": "simdutf", "version": "6.4.0", "relationship": "STATIC_LINK", "disposition": "payload", "licenseDeclared": "MIT", "sourceSubpath": "deps/v8/third_party/simdutf", "processVersionKey": "simdutf", "licenseEvidence": { "kind": "license-section", "heading": "simdutf", "sourceSubpath": "deps/v8/third_party/simdutf" } },
    { "name": "ada", "version": "3.4.4", "relationship": "STATIC_LINK", "disposition": "payload", "licenseDeclared": "MIT", "sourceSubpath": "deps/ada", "processVersionKey": "ada", "licenseEvidence": { "kind": "license-section", "heading": "ada", "sourceSubpath": "deps/ada" } },